<?xml version="1.0" encoding="UTF-8"?>
<!--
 -  
 - Licensed under the Apache License, Version 2.0 (the "License");
 - you may not use this file except in compliance with the License.
 - You may obtain a copy of the License at
 -  
 -      http://www.apache.org/licenses/LICENSE-2.0
 -  
 - Unless required by applicable law or agreed to in writing, software
 - distributed under the License is distributed on an "AS IS" BASIS,
 - WITHOUT WARRANTIES OR CONDITIONS OF ANY KIND, either express or implied.
 - See the License for the specific language governing permissions and
 - limitations under the License.
-->
<!DOCTYPE mycat:rule SYSTEM "rule.dtd">
<mycat:rule xmlns:mycat="http://org.opencloudb/">

  <!-- 路由规则定义，定义什么表，什么字段，采用什么路由算法 -->
  <tableRule name="rule1">
    <rule>
      <columns>id</columns>
      <algorithm>func1</algorithm>
    </rule>
  </tableRule>

  <!-- 路由函数定义 -->
  <function name="func1"
    class="org.opencloudb.route.function.PartitionByLong">
    <property name="partitionCount">2</property>
    <property name="partitionLength">512</property>
  </function>

</mycat:rule>
